{"base_pass_registry":{"canonical_sha256":"f3175eaad399ad34b5cba3227f7f6e8f3b7f492ca50196c197b9de5d0b7496a3","path":"docs/optimization/data/pass-registry.v2.json","physical_sha256":"dd5a9ec5e8053a3fe178ebfad7a6518cb8a43b8c3b19cedc4739842f9934f1c5"},"candidate_evidence_sha256":"051d1ea2efeffb101fb0ace12491534b380696710cee503e0a36ce293eaee12c","candidates":[{"candidate_id":"bitset","duplicate_of":null,"eligible_oracle_structure_refs":[],"family_kind":"bitset","implementation_candidate_id":null,"implementation_cost":"high","legality_obligation_ids":["bitset.packed-layout","bitset.scalar-lowering","bitset.target-capability","bitset.observable-boundaries"],"legality_proof_path":"unclear","oracle_family_id":"bitset","oracle_structures":[{"eligible_for_candidate_screening":false,"eligible_for_ranking":true,"geometric_mean_speedup":0.8313522116850329,"ineligibility_reason":null,"meets_threshold":false,"oracle_family_id":"bitset","paired_datasets":3,"sizes":{"large":{"baseline_case_id":"rv64gc:oracle:bitset:boolean_and:large:baseline","baseline_metric_value":2253.0,"eligible_for_ranking":true,"family":"bitset","ineligibility_reason":null,"optimized_case_id":"rv64gc:oracle:bitset:boolean_and:large:optimized","optimized_metric_value":2720.0,"pair_id":"bitset:boolean_and:large","size":"large","speedup":0.8283088235294118,"structure_id":"boolean_and"},"medium":{"baseline_case_id":"rv64gc:oracle:bitset:boolean_and:medium:baseline","baseline_metric_value":1308.0,"eligible_for_ranking":true,"family":"bitset","ineligibility_reason":null,"optimized_case_id":"rv64gc:oracle:bitset:boolean_and:medium:optimized","optimized_metric_value":1579.0,"pair_id":"bitset:boolean_and:medium","size":"medium","speedup":0.8283723875870804,"structure_id":"boolean_and"},"small":{"baseline_case_id":"rv64gc:oracle:bitset:boolean_and:small:baseline","baseline_metric_value":685.0,"eligible_for_ranking":true,"family":"bitset","ineligibility_reason":null,"optimized_case_id":"rv64gc:oracle:bitset:boolean_and:small:optimized","optimized_metric_value":818.0,"pair_id":"bitset:boolean_and:small","size":"small","speedup":0.8374083129584352,"structure_id":"boolean_and"}},"structure_id":"boolean_and"},{"eligible_for_candidate_screening":false,"eligible_for_ranking":true,"geometric_mean_speedup":0.8305687053984715,"ineligibility_reason":null,"meets_threshold":false,"oracle_family_id":"bitset","paired_datasets":3,"sizes":{"large":{"baseline_case_id":"rv64gc:oracle:bitset:boolean_or:large:baseline","baseline_metric_value":2347.0,"eligible_for_ranking":true,"family":"bitset","ineligibility_reason":null,"optimized_case_id":"rv64gc:oracle:bitset:boolean_or:large:optimized","optimized_metric_value":2832.0,"pair_id":"bitset:boolean_or:large","size":"large","speedup":0.8287429378531074,"structure_id":"boolean_or"},"medium":{"baseline_case_id":"rv64gc:oracle:bitset:boolean_or:medium:baseline","baseline_metric_value":1358.0,"eligible_for_ranking":true,"family":"bitset","ineligibility_reason":null,"optimized_case_id":"rv64gc:oracle:bitset:boolean_or:medium:optimized","optimized_metric_value":1633.0,"pair_id":"bitset:boolean_or:medium","size":"medium","speedup":0.8315982853643601,"structure_id":"boolean_or"},"small":{"baseline_case_id":"rv64gc:oracle:bitset:boolean_or:small:baseline","baseline_metric_value":705.0,"eligible_for_ranking":true,"family":"bitset","ineligibility_reason":null,"optimized_case_id":"rv64gc:oracle:bitset:boolean_or:small:optimized","optimized_metric_value":848.0,"pair_id":"bitset:boolean_or:small","size":"small","speedup":0.8313679245283019,"structure_id":"boolean_or"}},"structure_id":"boolean_or"},{"eligible_for_candidate_screening":false,"eligible_for_ranking":true,"geometric_mean_speedup":0.8033567009274484,"ineligibility_reason":null,"meets_threshold":false,"oracle_family_id":"bitset","paired_datasets":3,"sizes":{"large":{"baseline_case_id":"rv64gc:oracle:bitset:boolean_xor:large:baseline","baseline_metric_value":2265.0,"eligible_for_ranking":true,"family":"bitset","ineligibility_reason":null,"optimized_case_id":"rv64gc:oracle:bitset:boolean_xor:large:optimized","optimized_metric_value":2837.0,"pair_id":"bitset:boolean_xor:large","size":"large","speedup":0.7983785689108213,"structure_id":"boolean_xor"},"medium":{"baseline_case_id":"rv64gc:oracle:bitset:boolean_xor:medium:baseline","baseline_metric_value":1328.0,"eligible_for_ranking":true,"family":"bitset","ineligibility_reason":null,"optimized_case_id":"rv64gc:oracle:bitset:boolean_xor:medium:optimized","optimized_metric_value":1656.0,"pair_id":"bitset:boolean_xor:medium","size":"medium","speedup":0.8019323671497585,"structure_id":"boolean_xor"},"small":{"baseline_case_id":"rv64gc:oracle:bitset:boolean_xor:small:baseline","baseline_metric_value":694.0,"eligible_for_ranking":true,"family":"bitset","ineligibility_reason":null,"optimized_case_id":"rv64gc:oracle:bitset:boolean_xor:small:optimized","optimized_metric_value":857.0,"pair_id":"bitset:boolean_xor:small","size":"small","speedup":0.809801633605601,"structure_id":"boolean_xor"}},"structure_id":"boolean_xor"}],"overlaps_existing_pass_ids":[],"qualification_status":"blocked","qualifying_oracle_structure_refs":[],"rejection_reasons":["blocked_locked_bitset_capability_gap","unclear_legality"],"requires_boom_feature":false,"risk":"high","specification_status":"clear"},{"candidate_id":"boom_ilp","duplicate_of":null,"eligible_oracle_structure_refs":[{"oracle_family_id":"boom_ilp","structure_id":"dot_unroll4"},{"oracle_family_id":"boom_ilp","structure_id":"reduction_multi_acc"}],"family_kind":"standard","implementation_candidate_id":"candidate.integer-reduction-expansion","implementation_cost":"medium","legality_obligation_ids":["candidate.integer-reduction-expansion.integer-only","candidate.integer-reduction-expansion.canonical-loop","candidate.integer-reduction-expansion.reduction-identity","candidate.integer-reduction-expansion.modulo-i32-equivalence","candidate.integer-reduction-expansion.trip-count-remainder","candidate.integer-reduction-expansion.memory-effects","candidate.integer-reduction-expansion.live-outs","candidate.integer-reduction-expansion.profitability"],"legality_proof_path":"clear","oracle_family_id":"boom_ilp","oracle_structures":[{"eligible_for_candidate_screening":true,"eligible_for_ranking":true,"geometric_mean_speedup":1.0051685540881232,"ineligibility_reason":null,"meets_threshold":false,"oracle_family_id":"boom_ilp","paired_datasets":3,"sizes":{"large":{"baseline_case_id":"rv64gc:oracle:boom_ilp:dot_unroll4:large:baseline","baseline_metric_value":606252.0,"eligible_for_ranking":true,"family":"boom_ilp","ineligibility_reason":null,"optimized_case_id":"rv64gc:oracle:boom_ilp:dot_unroll4:large:optimized","optimized_metric_value":602167.0,"pair_id":"boom_ilp:dot_unroll4:large","size":"large","speedup":1.0067838323920109,"structure_id":"dot_unroll4"},"medium":{"baseline_case_id":"rv64gc:oracle:boom_ilp:dot_unroll4:medium:baseline","baseline_metric_value":75820.0,"eligible_for_ranking":true,"family":"boom_ilp","ineligibility_reason":null,"optimized_case_id":"rv64gc:oracle:boom_ilp:dot_unroll4:medium:optimized","optimized_metric_value":75319.0,"pair_id":"boom_ilp:dot_unroll4:medium","size":"medium","speedup":1.0066517080683492,"structure_id":"dot_unroll4"},"small":{"baseline_case_id":"rv64gc:oracle:boom_ilp:dot_unroll4:small:baseline","baseline_metric_value":2412.0,"eligible_for_ranking":true,"family":"boom_ilp","ineligibility_reason":null,"optimized_case_id":"rv64gc:oracle:boom_ilp:dot_unroll4:small:optimized","optimized_metric_value":2407.0,"pair_id":"boom_ilp:dot_unroll4:small","size":"small","speedup":1.0020772746157043,"structure_id":"dot_unroll4"}},"structure_id":"dot_unroll4"},{"eligible_for_candidate_screening":false,"eligible_for_ranking":true,"geometric_mean_speedup":1.2133097639654558,"ineligibility_reason":null,"meets_threshold":false,"oracle_family_id":"boom_ilp","paired_datasets":3,"sizes":{"large":{"baseline_case_id":"rv64gc:oracle:boom_ilp:independent_chains:large:baseline","baseline_metric_value":835660.0,"eligible_for_ranking":true,"family":"boom_ilp","ineligibility_reason":null,"optimized_case_id":"rv64gc:oracle:boom_ilp:independent_chains:large:optimized","optimized_metric_value":688197.0,"pair_id":"boom_ilp:independent_chains:large","size":"large","speedup":1.2142744010799233,"structure_id":"independent_chains"},"medium":{"baseline_case_id":"rv64gc:oracle:boom_ilp:independent_chains:medium:baseline","baseline_metric_value":104524.0,"eligible_for_ranking":true,"family":"boom_ilp","ineligibility_reason":null,"optimized_case_id":"rv64gc:oracle:boom_ilp:independent_chains:medium:optimized","optimized_metric_value":86085.0,"pair_id":"boom_ilp:independent_chains:medium","size":"medium","speedup":1.2141952721147702,"structure_id":"independent_chains"},"small":{"baseline_case_id":"rv64gc:oracle:boom_ilp:independent_chains:small:baseline","baseline_metric_value":3340.0,"eligible_for_ranking":true,"family":"boom_ilp","ineligibility_reason":null,"optimized_case_id":"rv64gc:oracle:boom_ilp:independent_chains:small:optimized","optimized_metric_value":2757.0,"pair_id":"boom_ilp:independent_chains:small","size":"small","speedup":1.2114617337685891,"structure_id":"independent_chains"}},"structure_id":"independent_chains"},{"eligible_for_candidate_screening":true,"eligible_for_ranking":true,"geometric_mean_speedup":1.0056193276791054,"ineligibility_reason":null,"meets_threshold":false,"oracle_family_id":"boom_ilp","paired_datasets":3,"sizes":{"large":{"baseline_case_id":"rv64gc:oracle:boom_ilp:reduction_multi_acc:large:baseline","baseline_metric_value":573479.0,"eligible_for_ranking":true,"family":"boom_ilp","ineligibility_reason":null,"optimized_case_id":"rv64gc:oracle:boom_ilp:reduction_multi_acc:large:optimized","optimized_metric_value":569393.0,"pair_id":"boom_ilp:reduction_multi_acc:large","size":"large","speedup":1.007176062930173,"structure_id":"reduction_multi_acc"},"medium":{"baseline_case_id":"rv64gc:oracle:boom_ilp: